{
  "schema_version": 1,
  "title_candidates": [
    "夜、知っている声に名前を呼ばれても返事をしてはいけない――ベンガルの『ニシル・ダーク』",
    "【インドの怪異】その声に返事をするな｜ベンガル地方に伝わる「ニシル・ダーク」",
    "亡くなった人の声で名前を呼ぶ？ ベンガル地方に伝わる夜の呼び声「ニシル・ダーク」"
  ],
  "thumbnail_text_candidates": [
    "その声に返事をするな",
    "夜の呼び声",
    "名前を呼ぶ声"
  ],
  "description": "夜中、よく知っている人の声で、名前を呼ばれたら――。\n\nインド東部からバングラデシュに広がるベンガル地方には、「ニシル・ダーク（নিশির ডাক／夜の呼び声）」と呼ばれる夜の怪異の言い伝えがあります。\nチンチラの語り部・大仏飴が、インド細密画風の紙芝居で、ニシの言い伝えと、語り手によって違う「何回呼ばれたら危ないのか」、そしてこの話が残してきた夜の知恵を紹介します。\n\n※物語のパートは、ベンガルに伝わるニシの話に共通する要素をもとに、動画用に組み立て直したものです。",
  "hashtags": [
    "#インド",
    "#民俗学",
    "#ベンガル",
    "#怪談",
    "#紙芝居"
  ],
  "tags": [
    "インド",
    "ベンガル",
    "ベンガル地方",
    "ニシル・ダーク",
    "Nishir Daak",
    "ニシ",
    "インドの怪談",
    "インドの民話",
    "民俗学",
    "怪異",
    "夜の呼び声",
    "紙芝居",
    "大仏飴",
    "チンチラ",
    "インド細密画",
    "バングラデシュ"
  ]
}