{
  "schema_version": 1,
  "title_candidates": ["【インド異聞】夜の川に灯りがともる話｜テスト用の架空の題材（公開用ではない）", "テスト用タイトル2", "テスト用タイトル3"],
  "thumbnail_text_candidates": ["夜の川の灯り", "灯りの正体は？", "テスト"],
  "description": "テスト用の架空の題材（公開用ではない）を、チンチラの語り部・大仏飴が紙芝居で紹介します。",
  "hashtags": ["#インド", "#民話", "#紙芝居"],
  "tags": ["インド", "民話", "紙芝居", "大仏飴"]
}
